row,text,label
109,"Its a very sensitive portrayal of life with unquenched or constrained desires. What does one do with desire in a culture and society with rigid norms? One husband finds outlet with the immigrant - since immigrants don't belong or aren't accepted, they don't need to conform and dam their desires. The other husband looks for solace in spirituality and tries to evaporate his desire into nothingness. It fails - of course - and he breaks down in the last scene for multiple reasons. Sita still cared enough for him to find that moment to let him know that he is not responsible for her deviant outlet to her blocked desires. The mother in her still couldn't find the strength to destroy his myth. She sees him as a child who is glorifying himself in his lust-control but should she give him the opportunity to finally grow up? Both the wives find courage and togetherness through their shared rejection by their husband. <br /><br />But the final act of rejection was by the grandmother - she could not break free from her rusted mindset to accept Sita's desire. A decade and more of receiving care was not enough to break the shackles of her culture.<br /><br />Seems like it was easiest for the househelp to let his desires flow - since he's anyway damned by his culture - being at the bottom of the hierarchy. Since there is anyway no respect and expectations, might as well taste sin.",1
110,"I admire Deepa Mehta and this movie is a masterpiece. I'd recommend to buy this movie on DVD because it's a movie you might want to watch more often than just once. And trust me, you'd still find little meaningful details after watching it several times.<br /><br />The characters - except for the grandmother perhaps - are all very balanced, no black and white. Even though you follow the story from the perspective of the two protagonists, there is also empathy for the other characters.<br /><br />I think the IMDb rating for the movie is far too low - probably due to its politically controversial content.",1
111,This was a bold movie to hit Indian cinemas when it was released. The first movie to perhaps openly depict lesbian tendencies amongst Indian women. The leading actress of Indian cinema Shabana Azmi added substance to the movie with her hot passionate scenes with Nandita Das.<br /><br />The movie oozed with sexuality and the director used sex in the best way possible. The sex was not for erotic purposes but was in the context of the movie. The scene where Nandita Das loses her virginity to her husband certainly was the first of its kind in Indian cinemas.<br /><br />Good acting by all the actors especially Nandita Das amidst criticism from the Indian public,1
112,"'Water' (2005), the final part of Toronto-based Indian film-director Deepa Mehta's elemental trilogy has been finally completed, almost ten years after the release of the very first controversial element, 'Fire' (1996), which was followed with a slightly lesser controversial sequel '1947: Earth' (1998). Mehta made her directorial debut with a 24-minute Canadian short film 'At 99: A Portrait of Louise Tandy Murch' (1975), but it was her Canadian feature film about the life of Indians living in Canada that brought her fame back in east, her country by birthright, 'Sam & Me' (1991). Recognition internationally came in the way of 'Camilla' (1994), starring Bridget Fonda, along with the actress who in 1990 won an Oscar in Best Actress in a Leading Role category at the age of 80, paving the way for middle-aged actresses to still have hope, for her portrayal of a stubborn old Jewish woman in 'Driving Miss Daisy' (1989), late Jessica Tandy. <br /><br />'Camilla' dealt with a friendship between two women from two other ends of the human lifespan, a May/December friendship. 'Camilla' was Tandy's last picture; she died the very same year.<br /><br />International fame followed Deepa Mehta in 1996 with the release of the controversial 'Fire', which spread with rage among the false patriotic consciousness existing Indian extremist. Having already explored friendship between two women in 'Camilla', in 'Fire' Mehta went a step further to portray a more intimate relationship between two lonely neglected women. Set in modern day India, the suburbs of the capital city of New Delhi, it shows two brothers and their wives, the elder brother (Kulbhushan Kharbanda) having joined a weird Hindu sect leads a life of celibacy, faithful to his guru of sexless existence. The younger brother (Javed Jaffrey) is having an extra marital affair with a Chinese woman (Alice Poon). Thus, both the wives, Shabana Azmi playing the elder brothers wife and Nandita Das the younger wife, find themselves neglected in their own way. One forced to lead a celibate life, thanks to her husband's eccentricities, and the other whose only interaction with her husband is through sex, and nothing more. Living in a world of in-laws and being the only two outsiders in the family, having nobody else to confide in, the two women fall in the arms of each other. Thus comes the issue of lesbianism. If there were an outside man's shoulder to cry on, there most probably would have been chance for them to fall into the arms of a man, but having no one else to confide in, their need for each others support is quite obvious. It does not necessarily state that all neglected women would end up taking lesbianism, it just happened to exist with regard to the two women in this context. All in all, the movie is excellent, and delves far deeper than just two women rolling in bed. The key focus isn't lesbianism in the movie, but the plight of modern day neglected Indian wives, even in the capital city, the two female characters just happen to have a sexual relationship. <br /><br />Two years later, Deepa Mehta's second installment was the element of mother earth, released in India by the name of '1947: Earth',yet another excellent movie by a great director, this time in the Hindi language, unlike 'Fire', which was made in the English language. <br /><br />Now Deepa Mehta has managed to complete the trilogy, despite a lot of problems, having released the final installment recently, 'Water'. No doubt it would be just as great as the other two.",1
113,"For all that has been said about the subject matter, and the controversy that surrounded it, please do not overlook what I feel to be the most important part of the film: the salient struggles of everyone to keep their pride through their trials. Whether dealing with self-imposed male braggadocio, a sexual reawakening, or even life itself, everybody is human.",1
114,"Deepa Mehta's ""Fire"" is groundbreaking, bold, and artistic. A masterful social commentary on the plight of the women from conservative, upper middle class Indian households, this is a film no one should miss. Shabana Azmi and Nandita Das give stellar performances by underplaying their characters as much as possible. A.R. Rahman's music is the work of the genius and almost plays the role of another character in the film. Mehta uses Rahman's score and together, they create such amazing sound montages that effectively portray the views of the world around Radha and Sita whenever they look to each other for support. This film is not about lesbianism as many have branded it. Lesbianism is just a part of the film. It is unfortunate that most people tend to write the film off calling it taboo instead of giving it a chance and looking at its real meaning.",1
115,The theme is controversial and the depiction of the hypocritical and sexually starved india is excellent.Nothing more to this film.There is a lack of good dialogues(why was the movie in english??). There was lack of continuity and lack of passion/emotion in the acting.,1
116,"The movie is really about choices. In the oppressed state of affairs as seen in Fire, where good women had to be obedient and do what was correct in the eyes of tradition, there seemed few options for Radha and Sita. However, granted that it was not their only option. What is life without desire, Radha questions Ashok. Yes, it's true that life provides us with a number of options but how many we can take depends on a number of external factors. When your world is confined to a small Indian household, being a dutiful daughter-in-law to a silent but observant still powerful matriarch, a dutiful wife of 13 years to a man who has taken a vow of celibacy due to your not being able to have a child, a man who only wants you lying next to him to prove his strength in eliminating his desires. I felt the ladies had little choice but to find solace in each other's company. I guess the fact that so many women applauded Ms Mehta's work, was because it provided them with an option to think for themselves. An option to do what was perhaps unacceptable. The lesbian scenes I felt was merely to put that point across. Every scene in the movie from the first at the Taj Mahal to the last at the Mosque, is etched in my mind. How frustrating to be a prisoner of your feelings and desires. To feel that you had to forgo the human touch to be a dutiful wife just because it is expected of you. To have to suppress any desire you might have and to crave for the human touch. What then is the meaning of our existence one wonders. In the scene where Sita is crying alone in the room and Radha comes in to comfort her, their lips accidentally brush against each others and it awakens a feeling in them. Something they have both been deprived of.<br /><br />Bravo to Ms Mehta in translating her vision so clearly. I especially like the flashbacks to the young Radha trying to 'see' for the ocean. It is a metaphor for freedom. Freedom to choose, freedom to transport ourselves to places we would normally be unable to reach. In those scenes, it is gently told to us that her sense of duty has also been passed down from her mother who I assume lives within the rich Indian traditions of duty in marriage. The movie is beautifully filmed and enhanced by the musical score by A.R. Rahman. Since the film, I have become ardent fans of the two lead actresses and the director. I look forward to more of Ms Deepa's future productions.",1
117,"Easily one of the best Indian films ever. Granted, that's not saying much(I made this conclusion after a whopping 15 minutes of watching). But I can truly say that Fire is also one of the really beautiful and brilliant films I've seen.<br /><br />Beautiful because of its imagery. The best example I can give is the parallelism between the 2 female leads(Radha and Sita) and the characters of the same name in Hindu mythology. Sita, for example, is the wife of the revered Lord Ram. As legend goes, Ram subjugates his wife by making her walk through a Fire to prove her `purity.' Sita, in response, cries and leaves him, reuniting with her mother(the Earth). This story has all sort of crazy links to the stories of the 2 Indian women(Nandita Das and Shabana Azmi). The word `Fire' all of a sudden has many meanings - marriage, tradition, religion, motherhood, and probably a few others I didn't catch.<br /><br />Brilliant because of its social overtones. Many who were offended by the premise for this movie should in fact be first to see Fire(e.g. my mom, who actually loved it). Why? Because although Fire is an attack on tradition, it is also an attack on tradition. In other words, that is its strength, NOT its weakness. Traditional conservative social mores(whether Indian or Canadian or American or whatever) are useless if they enslave you. Gender roles and self-denial can both do this.<br /><br />These are the things I took with me after seeing Fire. Hats off to Deepa Mehta",1
118,"As well as being a portrayal of a lesbian love story, FIRE is also a comic satire of middle-class (?) Indian culture. I find this is a quality which is little appreciated about the movie. These two genres (i.e. deep meaningful alternative-love story and comic satire) usually mix together just as well as oil and water do, but Mehta (somehow) manages to achieve the balance to near perfection. The servant Jatin's behaviour, the family's treatment of him, the bedridden grandmother's constant inescapable presence, Ashok's obsession with a swami's teachings: coming from a culture much like India's, these are things I can immediately identify as being typical. They have been crying out to be pointed out and ridiculed. While developing her primary subject matter, Mehta manages to achieve this secondary theme skillfully. In fact, much of the humour in the film which provides essential relief from the heavy subjects of taboo lesbian love and gender issues, stem from this satire of the seemingly ordinary. The film flows from the comic to the serious with great subtelty.<br /><br />All in all, brilliant use of symbolic devices (Radha compared to Sita of legend and coming out of Fire unscathed and, therefore pure; the lifelong desire of the young Radha to see the ocean finally achieved when she gains freedom). Kudos to Shabana Azmi(Radha), the lighting crew and Deepa Mehta; their very un-Hollywood-like (and un-Bollywood-like!) talents made this movie special. One criticism: the first scenes seemed rather disjointed to me in that they did not flow into each other very well.<br /><br />The verdict: 9 on 10. Nothing less for a movie with scenes so burned on my mind.",1
119,"For a moment, let's put aside the cultural aspects of this movie, even if it is a very important side of it, and let's look at the simple fact that this is a very nice love story. Two individuals find themselves in a difficult situation, caused by two selfish husbands. They have to live through their sad days without any ray of hope. If each one of these two women had been alone, imagine what kind of life each one would have had to accept. They found each other and they fell in love. That this love was against all the social, religious and cultural laws of their environment is almost irrelevant. They loved each other, found relief in each other, that was sufficient. The reaction of the individuals around them is but a small fact that they have to accept, suffer even, and then they can go on with their lives, their life. Very nice.",1
120,"<br /><br />Her Excellency Madam Shabana Azmi has worked in countless movies over life time. I think best is yet to come.<br /><br />Fire is ok.<br /><br />But still good days are yet to come.<br /><br />Hopefully, in Water I will be able see her better.<br /><br />Thanks and Regards.<br /><br />PS: India doesn't have a director to make best use of her.",1
121,"...means ""take up and read"", which is precisely what I felt like doing after having seen this marvelous film.<br /><br />Von Ancken stimulates and inspires with this breathtaking and superbly executed adaptation of Tobias Wolff's 1995 New Yorker article of the same name. The incredible performance by Tom Noonan is brilliant and provocative and the editing, sound design, cinematography and directing are truly inspired. The nuanced changes and embellishments on the original story are subtle, clever, and make the film cinematically more dynamic. It's lyrical pacing is mesmerizing and begs you to watch it again.<br /><br />Watch out for this young director...he's going places.",1
122,"Although Bullet In The Brain is, without question, superior amongst short films, it largely seems more like a short piece of writing than a film. And it is a little hard to feel too sorry for the teacher when his smart ass remarks get him shot. But after the bullet enters his brain we begin to understand a little bit about why he became so jaded with life in the first place. There is an awful amount of detail packed into this reasonably short film and this is what makes me feel that it should have been extended a little bit - it seems like there's almost too much to take in at once as the details come flying at you so fast. A slightly more relaxed pace and a less po-faced narrator in the final section would have benefitted this film a little bit. Despite these complaints, there is no denying that Bullet In The Brain is a quite stupendous work compared to many short, and even full length films. The makers should be applauded for trying to make such a basically emotional and literate film in the current climate of quick jokes and Hollywood action.",1
123,"This is a very, very odd film...one that is so odd it's best you just see it for yourself. The film begins with a jaded professor haranguing his class because the students have the audacity to not be as incredibly brilliant as he is! You can tell very quickly that this man is a total cynic--finding the value in practically nothing but sticking to his own inner sense of self-importance. Additionally, he seems tired and bored with the monotony of life.<br /><br />Later in the film, he walks into a bank robbery and manages to annoy the robbers so much that one of them shoots him in the head. Oddly, this is only half-way through the film and what followed was a very bizarre narration of the final seconds of his life. This is when the film becomes exciting because the style of the narration is just like one of this literature professor's novels--one that is intelligently written and says things the way we wish we could all say them.<br /><br />See this weird film--it's amazingly compelling and not like anything I've ever seen before.",1
124,"The finest short I've ever seen. Some commentators suggest it might have been lengthened, due to the density of insight it offers. There's irony in that comment and little merit. The acting is all up to Noonan and he carries his thankless character perfectly. I might have preferred that the narrator be less ""recognizable"", but the gravitas lent is pitch perfect. This is a short for people who read, for those whose ""bar"" is set high and for those who recognize that living in a culture that celebrates stupidity and banality can forge contrary and bitter defenders of beauty. A beautiful short film. FWIW: I was pleased at the Picasso reference, since I once believed that Picasso was just another art whore with little talent; like, I assume, most people - until the day I saw some drawings he made when he was 12. Picasso was a finer draftsman and a brilliant artist at that age than many artists will ever become in a lifetime. I understood immediately why he had to make the art he became known for.",1
125,"This movie, with all its complexity and subtlety, makes for one of the most thought-provoking short films I have ever seen. The topics it addresses are ugly, cynical, and at times, even macabre, but the film remains beautiful in its language, artful with its camera angles, and gorgeous in its style, skillfully recreating the short story of the same name written by a master of short stories, Tobias Wolff.<br /><br />Not wishing to spoil anything of the movie, I won't go into any details, other than to say that this movie is magnificent in and of itself. It takes pride in what it does, and does it well. It shows the most important memories of life, all of which can be topped by the single most elusive feeling: unexpected bliss. This movie, of its own volition, has created in me the same feelings the main character (Tom Noonan) felt when words transformed his very existence, and that is one impressive feat.",1
126,"This short deals with a severely critical writing teacher whose undiplomatic criticism extends into his everyday life. When he learns why that's not a good idea, we learn a bit about the beautiful craft of writing that he's been lecturing on.",1
127,"Well, I have to disagree with Leonard Maltin on this animated short. He loves it and claimed it was hilarious. I enjoyed it but didn't see any humor. He doesn't even like hockey or know anything about it, and still loved the story. Living right across the border from Canada, I have watched hockey for 50 years both there and in Buffalo....but I didn't think much of this cartoon. Oh, it was interesting and I know what would happen if you wore a Toronto jersey up in the Quebec area - disaster! That especially holds true in the glory years of Les Canadians. However, that doesn't make the story funny. <br /><br />Back in the 1950s, everyone in the Quebec provinces idolized the Montreal Canadians and their star player, Maurice Richard, and everyone wanted to be like him. When his mother orders a new sweater, it has the Toronto Maple Leafs emblem on it, so the kid doesn't want to be caught dead wearing it.. When he finally does and heads to the local rink, he gets ostracized from the rest of his hockey buddies. What's so funny about that? I could see the same thing happening to a kid in Boston who is Red Sox die-hard and his mom gets him Yankees shirt! Horrors! You couldn't wear it, and vice-versa.<br /><br />Maybe to someone who doesn't follow sports at all, like Maltin, this situation seems odd and humorous to him...but it's a fact of life or any bit-time sports fan and his favorite team. It was an interesting story, and totally believable, but nothing that made me laugh.<br /><br />The art was fun to look at throughout, almost like looking at a long series of crayon paintings done by a talented school kid. The French Canadian accent was good, too. This movie was part of the DVD ""Leonard Maltin's Animation Favorites From The National Film Board Of Canada.",1
128,"Having been raised in Canada, I saw this short many times mostly on the CBC. I have seen it numerous times, at many ages in my life, and each time the reactions are the same. It is a joyous bittersweet, beautifully animated film that tugs at your heart. I am sure I have it on some VHS tape somewhere digging around.<br /><br />Every kid growing up can relate to the situation, and wanting to fit in with your favourite idols. The scene and look on the kids face when his mom is filling out the Eatons catalogue and his jumping around the room is priceless. I haven't seen someone capture that carefree mood of youth on film as well as this little short has.<br /><br />Sure I am a Montreal habs fan, and that makes my appreciation for it more special. But in the end it is the nostalgic look and feel of pond hockey, and the memories of your family telling you that you should be greatful for what you get even if it isn't exactly what you wanted. And oh yeah, the animation is beautiful too ;)<br /><br />Rating 10 out of 10",1
129,"Animated shorts just don't get much better than this wonderful Canadian film. This short feature is dripping with Canadian references, and so, this film will probably be appreciated by Canadians most of all. But the basic story is universal, and it is told lovingly by writer Roch Carrier. It is a hilarious story that I have known for quite sometime, and I was recently fortunate enough to see it again, so I simply HAD to write a hearty recommendation for it. This is a masterpiece, and a must-see whether or not you are Canadian.",1
130,"This marvelous short will hit home with everyone who, as a child, specifically asked for something because it was hip or cool, only to be given something that would mark you for life with your peers and were told by your Mom or Dad (or both) that it didn't matter, as you earnestly began considering enlisting in a Witness Protection Program in order to avoid ridicule. For those U.S. residents who don't get the horror because you don't follow hockey, it's like a Dallas Cowboy fan getting a Washington Redskins jersey or a Yankees fan getting a Red Sox jersey. It isn't pretty. For our European friends, think of two great rival football (soccer to us) clubs and imagine a fan of one getting a jersey from the other. Ouch!!! NFB of C outdid themselves here!<br /><br />Une hommage du Maurice ""Rocket"" Richard, merci, M. Richard.",1
131,"A boy who adores Maurice Richard of the Montreal Canadiens receives, much to his horror, a Toronto Maple Leafs sweater in the mail. I recently watched this in a class in which few of the students were interested in hockey, but nearly everyone knew about Maurice Richard and the Toronto/Montreal rivalry. Highly entertaining, amusing, and accurate.",1
132,"I would assume that this film would get rave reviews in Canada--particularly in Quebec. That's because the Canadians have traditionally loved hockey and the Montreal Canadians were like gods in Canada for decades. As an American, the closest thing we have to them are the New York Yankees. If you are a fan, then they are the greatest and winningest team in history. If you are not a fan, then they are Satan's team!! Well, at least that's how it was as I grew up in Washington, DC in regard to the Dallas Cowboys. So I am pretty sure when this film was shown up North that everyone immediately had a strong emotional reaction--their national sport AND the closest thing they have to a national team in the NHL.<br /><br />Now the cartoon itself is moderately interesting when it begins and the main character talks about growing up around Ottawa and rooting for the Canadians AND Maurice ""the Rocket"" Richard. However, when his mother accidentally buys him a Toronto Maple Leafs jersey and forces him to wear it, I knew right away what a horrible and shameful thing this would be to a little boy. This ability to connect to the character--even though he lives in a far off land is what made this a very special short film. The way the other kids treated him and his conversation with God at the end make this a lovely nostalgic film. Very clever and memorable.",1
