row,text,label
80,"When a man who doesn't have Alzheimer's can't remember how many films he's made, he probably is the world's most prolific director after all. That man is Jesus Franco, the king of so-called 'eurotrash'. His 1980 flick Devil Hunter is as rushed, opaque, stupid, lazy and exploitative in the truest sense of the word (the film's title is misleading, for starters) as any other Franco film I've seen. That makes it sound pretty awful, and it is... Yet Franco does have some kind of inimitable sensibility, a generous way with the baldly outrageous, with nudity and sleaze and violence, and even with his stupid cheap editing which tries to pave over the extreme haste with which all his films were made. The mix of all these elements causes you to ride his films out, even while you're mostly waiting for them to end because they're so very tedious.<br /><br />Devil Hunter is nigh on incomprehensible for the first half an hour. The kidnap by strangers of a white woman who seems to be a model or film star is intercut with a bunch of native action in South America. There's lots of naked writhing, dancing, and endless repeated zoom-ins on an ugly totem pole. You need to get used to the repetitive zoom-ins and the technique of cutting back to the same shot about three times in a row right away, as these are Franco's main methods of extending a film out to feature length.<br /><br />The monster who looks like the totem pole is actually kind of scary. He has raw bug eyes and his presence is always signalled on the soundtrack by cacophonous groaning, apparently recorded in an echo chamber. Early in the piece he chews on a native lady strapped to a tree, and it's hard to know what really happens here but I think he ate her stomach (or her genitals, sweet Jesus!).<br /><br />Anyway, the adventure begins properly when a studly guy and his freaked out Vietnam vet pal are sent to the island to recover the white girl from the kidnappers. The flakey guy has an accent which, as dubbed, is half Brooklyn-American, half English-Liverpudlian and all retarded. All of the dialogue and dubbing is ridiculous and laughable, making for another layer of the film which can somehow hold your interest.<br /><br />Not too much really happens from here on in, and it happens pretty sluggishly, studded with the odd bit of outrage like a rape. The nebulous action is fleshed out (haha!) by acres of 360 degree nudity from the natives and the two female leads, and even from the monster himself. That he walks around with his penis exposed makes wrestling him an unappetising prospect for the tough guy hero, but it's gotta be done at some point, and it's nice to note that the director will show anyone's genitals on camera.<br /><br />The best feature of Devil Hunter is the location filming. Franco can be extremely cheap with the structural and story aspects of film-making, but he doesn't muck around with sets. You get real islands, jungles, helicopters and mountains, all in widescreen. This is something that is really cool to experience in these days of crappy CGI sets and backdrops ad nauseam.<br /><br />Ultimately, issues of recommendation where this film is concerned seem moot. If you're trying to see all the Video Nasties, you will have to watch this at some point, and you'll be made as restless as I was. If you like Franco, you'll watch this anyway. If you fall into neither of the above categories, the odds are you'll never come across this film. Copies of it aren't just lying around, and I could hardly recommend the seeking out of it. It's Franco. Lazy, crazy Franco.",0
81,"I have been looking for this film for ages because it is quite rare to find as it was one of the video nasties. I finally found it on DVD at the end of last year it is a very low budget movie The story is set around amazon jungle tribes that are living in fear of the devil. Laura Crawford is a model who is kidnapped by a gang of thugs while she is working in South America. They take her into the jungle Laura is guarded by some ridiculous native who calls himself ""The Devil"" she has to go though all unpleasant things until they are happy. Maidens are Chained up. The devil demonstrates eating flesh in a horrible manner. Peter Weston, is the devil hunter, who goes into the jungle to try and rescue her,",0
82,"As the number of Video Nasties I've yet to see dwindles, this little pile of garbage popped up on my ""to rent"" list when I saw it was available.<br /><br />The premise involves a fashion model or something being kidnapped and taken into the jungle to be held for ransom by a motley crew of idiots. Some other goof gets hired to bring her back and is given a sack of money to use as a bargaining chip, though if he returns with the girl and all the money, he gets a significant cut. He's brought a helicopter and pilot with him and, wow, that pilot is one of the worst actors EVER! Granted, they are all totally terrible and the dubbing will make you cry blood. After stealing away into the jungle, we learn that nearby is a cannibal cult whose flesheating earthbound god wanders the woods like a human King Kong looking for tribeswomen to ravage and devour. Now, this fellow is just a naked guy with some of the worst makeup ever, ping-pong balls for eyes and that's pretty much it. His growls and groans are an everpresent feature on the soundtrack, and I found myself muting much of those scenes.<br /><br />Oh, did I forget to mention the almost constant nudity? This is probably the main reason this film was banned, though there is one specific scene, about one second long, where the god attacks a girl and pulls her guts out, but it's not a redeeming factor for gore fans. Also, Jess Franco goes beyond the usual T and A and shows lengthy close-ups of female genitals, and, sadly, male as well. So, if you want ""fair"" in terms of exploitation, you got it.<br /><br />I can't recommend this trash to anyone. It's not even the good bad movie. It's just atrociously padded trash that only a Video Nasty fan will probably view and even then, if you are making your way through the list, leave this for the very last. If you watch it first, you may get the notion that this is the norm for the list, which is certainly not true.",0
83,"Not sure if I'm referring to those who labeled this a video nasty or to the director...""Devil Hunter"" sure is one bizarre 'horror' movie.<br /><br />The plot is a loosey goosey combo of superior films like ""Cannibal Ferox"" and ""Cut and Run."" Chick gets kidnapped in the 'jungle' by a 'tribe' of 'savages.' The jungle looks more like a park somewhere in Mexico. The tribe is like a group of hippies who walk around in Party City-style Halloween costume renditions of tribal garb. And the savages range in race from white to Asian to black to hispanic. I suppose Franco just grabbed anyone who looked even slightly ethnic for this romp.<br /><br />To make matters worse, this film has ultra-minimal gore, no real scares and a lot of unnecessary penis. Not fun. I can find something to like in just about any sleazy Italian or Euro-trash film; this one just fell WAY short.<br /><br />2 out of 10, kids.",0
84,"This video nasty was initially banned in Britain, and allowed in last November without cuts.<br /><br />It features the Playboy Playmate of the Month October 1979, Ursula Buchfellner. The opening cuts back and forth between Buchfellner and foggy jungle pictures. I am not sure what the purpose of that was. It would have been much better to focus on the bathtub scene.<br /><br />Laura (Buchfellner) is kidnapped and held in the jungle for ransom. Peter (Al Cliver - The Beyond, Zombie) is sent to find her and the ransom. Of course, one of the kidnappers (Antonio de Cabo) manages to pass the time productively, while another (Werner Pochath) whines incessantly.<br /><br />The ransom exchange goes to hell, and Laura runs into the jungle. Will Peter save her before the cannibals have a meal? Oh, yes, there are cannibals in this jungle. Why do you think it was a video nasty! Muriel Montossé is found by Peter and his partner (Antonio Mayans - Angel of Death) on the kidnapper's boat. Montossé is very comfortably undressed. Peter leaves them and goes off alone to find Laura, who has been captured by now. They pass the time having sex, and don't see the danger approaching. Guts, anyone? Great fight between Peter and the naked devil (Burt Altman).<br /><br />Blood, decapitation, guts, lots of full frontal, some great writhing by the cannibal priestess (Aline Mess), and the line, ""They tore her heart out,"" which is hilarious if you see the film.",0
85,"Of the three titles from Jess Franco to find their way onto the Official DPP Video Nasty list (Devil Hunter, Bloody Moon and Women Behind Bars) this is perhaps the least deserving of notoriety, being a dreadfully dull jungle clunker enlivened only very slightly by a little inept gore, a gratuitous rape scene, and loads of nudity.<br /><br />Gorgeous blonde Ursula Buchfellner plays movie star Laura Crawford who is abducted by a gang of ruthless kidnappers and taken to a remote tropical island inhabited by a savage tribe who worship the 'devil god' that lurks in the jungle (a big, naked, bulging-eyed native who likes to eat the hearts of nubile female sacrifices).<br /><br />Employed by Laura's agent to deliver a $6million ransom, brave mercenary Peter Weston (Al Cliver) and his Vietnam vet pilot pal travel to the island, but encounter trouble when the bad guys attempt a double-cross. During the confusion, Laura escapes into the jungle, but runs straight into the arms of the island's natives, who offer her up to their god.<br /><br />Franco directs in his usual torpid style and loads this laughable effort with his usual dreadful trademarks: crap gore, murky cinematography, rapid zooms, numerous crotch shots, out of focus imagery, awful sound effects, and ham-fisted editing. The result is a dire mess that is a real struggle to sit through from start to finish (It took me a couple of sittings to finish the thing), and even the sight of the luscious Buchfellner in all of her natural glory ain't enough to make me revisit this film in a hurry.",0
86,"How can you tell that a horror movie is terrible? when you can't stop laughing about it of course! The plot has been well covered by other reviewers, so I'll just add a few things on the hilarity of it all.<br /><br />Some reviews have placed the location in South America, others in Africa, I thought it was in some random island in the Pacific. Where exactly does this take place, seems to be a mystery. The cannibal tribe is conformed by a couple of black women some black men, and a man who looks like a young Frank Zappa banging the drums... the Devil God is a large black man with a terrible case of pink eyes.<br /><br />One of the ""freakiest"" moments in the film is when, ""Pablito"" find his partner hanging from a tree covered in what seems to be an orange substance that I assume is blood, starts screaming for minutes on and on (that's actually funny), and then the head of his partner falls in the ground and ""Pablito"" kicks it a bit for what I assume is ""shits n' giggles"" and the eyes actually move...<br /><br />But, of course, then the ""freak"" is gone when you realize the eyes moved because the movie is just bad...<br /><br />I hadn't laughed like this in a loooong while, and I definitely recommend this film for a Sunday afternoon with your friends and you have nothing to do... grab a case of beers and start watching this film, you'll love it! If you are looking for a real horror or gore movie, though... don't' bother.",0
87,"A model named Laura is working in South America when she is kidnapped from her hotel room by a gang and taken into the jungle. They demand a huge ransom for her release. Peter is hired to get her home safe and there is a bonus in it for him if he can bring back the money as well as the girl. Peter is taken to the jungle by helicopter with friend Jack. They try to give the kidnappers fake money in return for Laura but the plan goes horribly wrong and they have to bail out in the helicopter. The helicopter is shot and they also have to bail from that (not going well so far). Also roaming the jungles is a devil of sorts. In reality its just a naked black guy with weirdly big eyes and a breathing problem. He starts to kill a few of the kidnappers and Laura escapes only to be captured by some primitives. The rest of the film is a bit of a blur really.<br /><br />Now I'm not a massive Jess Franco fan, in fact to date this is only the second film of his I have seen, but even I can tell that this really isn't one of his best efforts. The films drags along at a pretty slow pace without much at all happening. The whole thing could have been edited down quite easily into a 25 minute TV show. There are plenty of overly long shots of people walking through the jungle that could have just been lifted straight out.<br /><br />Devil Hunter is poorly lit (Infact I don't think it was lit at all), badly dubbed, poorly acted and slow yet for some reason it didn't bore me. I think the main reason for this was some of the hilariously bad scenes in it. For example a scene where Laura is walking in the street was obviously shot in a real street as crowds of people stop to stare straight at the camera as its shooting. Another funny scene has one of the gang who has been killed, hung in a tree dripping blood as one of his friends stands directly under him screaming for what seems like minutes. Then for no reason at all the man in the trees head just falls of and hits the guy under him. It has to be seen to be believed. Then of course there is the actual devil. It is just some naked black guy who despite the fact he has massive eyes, he has very blurry vision.<br /><br />The film was hooked up in part of the video nasty scare in the 80's here in the UK and was banned. Now why it was I have no idea. There is very little gore at all and it's hardly a shocking film. Minus the nudity I would have said that it could get away with a PG almost. The only thing I can think of is that it was never actually watched and was added to the original list because of word of mouth.<br /><br />There is not much reason to watch this film really unless you are a massive Jess Franco fan. There is plenty of nudity to keep you from falling asleep and also some scenes that are so bad you can have a good laugh at them but other wise I would say just pay for a ticket to South America and get lost in a jungle. It would probably be more fun.<br /><br />3/10",0
88,"An actress making a movie in Africa is kidnapped and taken into the jungle where she is held for ransom. The producer hires some one to go and bring her back. Complicating everything are the cannibals in the jungle who worship a really ugly looking ""god"" who likes to eat naked women.<br /><br />This is a gory sleazy movie. There is copious amounts of nudity and violence, not to mention violence against nude people. Its an exploitation film designed to appeal to the deepest darkest parts of our being, and if the movie wasn't so boring this film would be a classic. Lets face it, despite the gore, the nasty sex and abuse,and the ugly monster this movie is a snoozer. The pacing is all off kilter and it puts you out. There are multiple plot lines that all seem to be happening separately from each other, even though its ultimately all one story. Worst of all, almost no one says anything. Most of the minimal dialog concerns the cruelty or one characters protestations that ""I'll do what I want"". Its such a quiet and dull movie that if it weren't for the frequent screams of the victims I'd recommend this as a sleep aide.<br /><br />This is a movie to avoid unless you need sleep, or unless you need to see every Euro-cannibal movie.<br /><br />(An aside. VideoAsia just released this as part of their Terror Tales series. Their print is oddly letter-boxed which looks to be the result of taking their print from a Japanese source (there is fogging) that was cropped to remove the subtitles. Their print also has no opening titles)",0
89,"or anyone who was praying for the sight of Al Cliver wrestling a naked, 7ft tall black guy into a full nelson, your film has arrived! Film starlet Laura Crawford (Ursula Buchfellner) is kidnapped by a group who demand the ransom of $6 million to be delivered to their island hideaway. What they don't count on is rugged Vietnam vet Peter Weston (Cliver) being hired by a film producer to save the girl. And what they really didn't count on was a local tribe that likes to offer up young women to their monster cannibal god with bloodshot bug eyes.<br /><br />Pretty much the same filming set up as CANNIBALS, this one fares a bit better when it comes to entertainment value, thanks mostly a hilarious dub track and the impossibly goofy monster with the bulging eyes (Franco confirms they were split ping pong balls on the disc's interview). Franco gets a strong EuroCult supporting cast including Gisela Hahn (CONTAMINATION) and Werner Pochath (whose death is one of the most head-scratching things I ever seen as a guy who is totally not him is shown - in close up - trying to be him). The film features tons of nudity and the gore (Tempra paint variety) is there. The highlight for me was the world's slowly fistfight between Cliver and Antonio de Cabo in the splashing waves. Sadly, ol' Jess pads this one out to an astonishing (and, at times, agonizing) 1 hour and 40 minutes when it should have run 80 minutes tops. <br /><br />For the most part, the Severin DVD looks pretty nice but there are some odd ghosting images going on during some of the darker scenes. Also, one long section of dialog is in Spanish with no subs (they are an option, but only when you listen to the French track). Franco gives a nice 16- minute interview about the film and has much more pleasant things to say about Buchfellner than his CANNIBALS star Sabrina Siani.",0
90,"Devil Hunter gained notoriety for the fact that it's on the DPP 'Video Nasty' list, but it really needn't have been. Many films on the list where there for God (and DPP) only known reasons, and while this isn't the tamest of the bunch; there isn't a lot here that warrants banning...which is a shame because I never would have sat through it where it not for the fact that it's on 'the shopping list'. The plot actually gives the film a decent base - or at least more of a decent base than most cannibal films - and it follows an actress who is kidnapped and dragged off into the Amazon jungle. A hunter is then hired to find her, but along the way he has to brave the natives, lead by a man who calls himself ""The Devil"" (hence the title). The film basically just plods along for eighty five minutes and there really aren't many scenes of interest. It's a real shame that Jess Franco ended up making films like this because the man clearly has talent; as seen by films such as The Diabolical Dr Z, Venus in Furs, Faceless and She Kills in Ecstasy, but unfortunately his good films are just gems amongst heaps of crap and Devil Hunter is very much a part of the crap. I saw this film purely because I want to be able to say I've seen everything on the DPP's list (just two more to go!), and I'm guessing that's why most other people who have seen it, saw it. But if you're not on the lookout for Nasties; there really is no reason to bother with this one.",0
91,"This film seemed way too long even at only 75 minutes. The problem with jungle horror films is that there is always way too much footage of people walking (through the jungle, up a rocky cliff, near a river or lake) to pad out the running time. The film is worth seeing for the laughable and naked native zombie with big bulging, bloody eyes which is always accompanied on the soundtrack with heavy breathing and lots of reverb. Eurotrash fans will be plenty entertained by the bad English dubbing, gratuitous female flesh and very silly makeup jobs on the monster and native extras. For a zombie/cannibal flick this was pretty light on the gore but then I probably didn't see an uncut version.",0
92,"Sexo Cannibal, or Devil Hunter as it's more commonly known amongst English speaking audiences, starts with actress & model Laura Crawford (Ursula Buchfellner as Ursula Fellner) checking out locations for her new film along with her assistant Jane (Gisela Hahn). After a long days work Laura is relaxing in the bath of her room when two very dubious character's named Chris (Werner Pochath) & Thomas (Antonio Mayans) burst in & kidnap her having been helped by the treacherous Jane. Laura's agent gets on the blower to rent-a-hero Peter Weston (Al Cliver) who is informed of the situation, the kidnappers have Laura on an isolated island & are demanding a 6 million ransom. Peter is told that he will be paid 200,000 to get her back safely & a further 10% of the 6 million if he brings that back as well, faster than a rat up a drain pipe Peter & his Vietnam Vet buddy helicopter pilot Jack are on the island & deciding on how to save Laura. So, the kidnappers have Laura & Peter has the 6 million but neither want to hand them over that much. Just to complicate things further this particular isolated island is home to a primitive tribe (hell, in all the generations they've lived there they've only managed to build one straw hut, now that's primitive) who worship some cannibal monster dude (Burt Altman) with bulging eyes as a God with human sacrifices & this cannibal has a liking for young, white female flesh & intestines...<br /><br />This Spanish, French & German co-production was co-written & directed by the prolific Jesus Franco who also gets the credit for the music as well. Sexo Cannibal has gained a certain amount of notoriety here in the UK as it was placed on the 'Video Nasties' list in the early 80's under it's alternate Devil Hunter title & therefore officially classed as obscene & banned, having said that I have no idea why as it is one bad film & even Franco, who isn't afraid to be associated with a turkey, decides he wants to hide under the pseudonym of Clifford Brown. I'd imagine even the most die-hard Franco fan would have a hard time defending this thing. The script by Franco, erm sorry I mean Clifford Brown & Julian Esteban as Julius Valery who was obviously another one less than impressed with the finished product & wanted his named removed, is awful. It's as simple & straight forward as that. For a start the film is so boring it's untrue, the kidnap plot is one of the dullest I've ever seen without the slightest bit of tension or excitement involved & the horror side of things don't improve as we get a big black guy with stupid looking over-sized bloodshot eyes plus two tame cannibal scenes. As a horror film Sexo Cannibal fails & as an action adventure it has no more success, this is one to avoid.<br /><br />Director Franco shows his usual incompetence throughout, a decapitated head is achieved by an actor lying on the ground with large leaves placed around the bottom of his neck to try & give the impression it's not attached to anything! The cannibal scenes are poor, the action is lame & it has endless scenes of people randomly walking around the jungle getting from 'A' to 'B' & not really doing anything when they get there either. It becomes incredibly dull & tedious to watch after about 10 minutes & don't forget this thing goes on for 94 minutes in it's uncut state. I also must mention the hilarious scene when Al Cliver is supposed to be climbing a cliff, this is achieved by Franco turning his camera on it's side & having Cliver crawl along the floor! Just look at the way his coat hangs & the way he never grabs onto to anything as he just pulls himself along! The gore isn't that great & as far as Euro cannibal films go this is very tame, there are some gross close ups of the cannibals mouth as it chews bits of meat, a man is impaled on spikes, there's some blood & a handful of intestines. There's a fair bit of nudity in Sexo Cannibal & an unpleasant rape scene.<br /><br />Sexo Cannibal must have had a low budget & I mean low. This is a shoddy poorly made film with awful special effects & rock bottom production values. The only decent thing about it is the jungle setting which at least looks authentic. The music sucks & sound effects become annoying as there is lots of heavy breathing whenever the cannibal is on screen. The acting sucks, the whole thing was obviously dubbed anyway but no one in this thing can act.<br /><br />Sexo Cannibal is a terrible film that commits the fatal mistake of being as boring as hell. The only good things I can say is that it has a certain sleazy atmosphere to it & those close ups of the cannibal chewing meat are pretty gross. Anyone looking for a decent cinematic experience should give Sexo Cannibal as wide a berth as possible, one to avoid.",0
93,"Not only is it a disgustingly made low-budget bad-acted movie, but the plot itself is just STUPID!!!<br /><br />A mystic man that eats women? (And by the looks, not virgin ones)<br /><br />Ridiculous!!! If you´ve got nothing better to do (like sleeping) you should watch this. Yeah right.",0
94,"This is the worst thing the TMNT franchise has ever spawned. I was a kid when this came out and I still thought it was deuce, even though I liked the original cartoon.<br /><br />There's this one scene I remember when the mafia ape guy explains to his minions what rhetorical questions are. It's atrocious. Many fans hate on the series for including a female turtle, but that didn't bother me. So much so that I didn't even remember her until I read about the show recently. All in all, it's miserably forgettable.<br /><br />The only okay thing was the theme song. Guilty pleasure, they call it... Nananana ninja...",0
