row,text,label
42,"WARNING: This review contains SPOILERS. Do not read if you don't want some points revealed to you before you watch the film.<br /><br />With a cast like this, you wonder whether or not the actors and actresses knew exactly what they were getting into. Did they see the script and say, `Hey, Close Encounters of the Third Kind was such a hit that this one can't fail.' Unfortunately, it does. Did they even think to check on the director's credentials? I mean, would YOU do a movie with the director of a movie called `Satan's Cheerleaders?' Greydon Clark, who would later go on to direct the infamous `Final Justice,' made this. It makes you wonder how the people of Mystery Science Theater 3000 could hammer `Final Justice' and completely miss out on `The Return.'<br /><br />The film is set in a small town in New Mexico. A little boy and girl are in the street unsupervised one night when a powerful flashlight beam.er.a spaceship appears and hovers over them. In probably the worst special effect sequence of the film, the ship spews some kind of red ink on them. It looked like Clark had held a beaker of water in from of the camera lens and dipped his leaky pen in it, so right away you are treated with cheese. Anyhow, the ship leaves and the adults don't believe the children. Elsewhere, we see Vincent Schiavelli, whom I find to be a terrific actor (watch his scenes in `Ghost' for proof, as they are outstanding), who is playing a prospector, or as I called him, the Miner 1949er. He steps out of the cave he is in, and he and his dog are inked by the ship. Twenty-five years go by, and the girl has grown up to be Cybill Shepherd, who works with her father, Raymond Burr, in studying unusual weather phenomena. Or something like that. Shepherd spots some strange phenomena in satellite pictures over that little New Mexico town, and she travels there to research it. Once she gets there, the local ranchers harass her, and blame her for the recent slew of cattle mutilations that have been going on, and deputy Jan-Michael Vincent comes to her rescue. From this point on, the film really drags as the two quickly fall for each other, especially after Vincent wards off the locals and informs Shepherd that he was the little boy that saw the ship with her twenty-five years earlier. While this boring mess is happening, Vincent Schiavelli, with his killer dog at his side, is walking around killing the cattle and any people he runs into with an unusual item. You know those glowing plastic sticks stores sell for trick-or-treaters at Halloween, the kind that you shake to make them glow? Schiavelli uses what looks like one of those glow sticks to burn incisions in people. It's the second-worst effect in the movie. Every time Schiavelli is on screen with the glow stick, the scene's atmosphere suddenly turns dark, like the filmmakers thought the glow stick needed that enhancement. It ends up making the movie look even cheaper than it is.<br /><br />And what does all this lead up to? It's hard to tell when the final, confusing scene arrives. See, Burr and his team of scientists try to explain the satellite images that Shepherd found as some kind of `calling card,' but none of it makes sense. Why do Shepherd and Vincent age and Schiavelli does not? Schiavelli explains why he is killing cattle and people and why he wants Shepherd dead, but even that doesn't make much sense when you really think about it. I mean, why doesn't he kill Jan-Michael Vincent? After all, he had twenty-five years to do it. And the aliens won't need him if Shepherd is dead anyhow, so why try to kill her? Speaking of the aliens, it is never clear what they really wanted out of Shepherd and Vincent. What is their goal? Why do they wait so long to intervene? How could they be so sure Shepherd would come back? Not that the answer to any of these and other questions would have made `The Return' any more pleasant. You would still have bad lines, really bad acting, particularly by Shepherd, cheesy effects, and poor direction. Luckily, the stars escaped from this movie. Cybill Shepherd soon went on to star in `Moonlighting' with Bruce Willis. Jan-Michael Vincent went on to be featured in dozens of B-movies, often in over-the-top parts. Raymond Burr made a pile of Perry Mason television movies right up until his death. Vincent Schiavelli went on to be a great character actor in a huge number of films. Martin Landau, who played a kooky law enforcement officer, quickly made the terrific `Alone in the Dark' and the awful `The Being' before rolling into the films he has been famous for recently. You can bet none of these stars ever want their careers to return to `The Return.' Zantara's score: 2 out of 10.",0
43,"As a kid I did think the weapon the murderer wielded was cool, however I was a kid and so I was a bit dumb. Even as a dumb kid though the movies plot was stupid and a bit boring when the killer was not using his light knife to kill people. What amazes me is that the movie has a really solid cast in it. What script did they read when agreeing to be in this movie as it is most assuredly boring and only a means to show off a light saber on a very small scale. The plot at times is incomprehensible and the end is totally chaotic. The whole film seems to rotate around aliens and the one weapon. The plot has two kids and some dude having an alien encounter, flash years later and there seems to be a return as it were in the mix. Dead animals and such to be explored and for some reason the one dude gets the weapon of the aliens and proceeds to use it to go on a very light killing spree. Seriously, you just have to wonder why this movie was made, if you are going to have a killer have some good death scenes, if you are going to have alien encounters show more than a weird light vortex thing, and if you are going to have light sabers then call yourself star wars.",0
44,"Jill Dunne (played by Mitzi Kapture), is an attractive, nice woman, over-whelmed by a smart-mouthed teenage daughter, Liv (Martha MacIsaac) and a petty, two-timing husband, Sean (Rick Roberts), both of which were tediously self-centered, and obnoxious.<br /><br />This was advertised as a troubled family stalked by a crazed killer during a relentless storm.<br /><br />The storm doesn't even happen until about the last 5 minutes of the film, and then it isn't anything to send anybody running to the storm cellar.<br /><br />The stalking, likewise doesn't get intense until almost the end of the film.<br /><br />Most of the film we spend listening to Jill and her insufferable daughter, Liv, argue until I just wanted to back slap the daughter into next week.<br /><br />Jill's problem with Liv is that she has taken up with Zack, a boy of questionable character, and they are constantly making out--in fact Jill comes home to find the two of them on Liv's bed.<br /><br />The rest of the time we spend listening to Jill's husband Sean either whine at Jill or criticize her.<br /><br />Sean was not at all appealing--since his face is so covered in freckles you could play connect the dots.<br /><br />The story begins with Jill being notified of an out-standing bill on their credit card for a hotel she has never been to, and that she thought Sean had never been to either.<br /><br />Jill goes to the hotel where she meets the owner & manager, Richard Grant (Nick Mancuso), a very nice, older, divorced man, who is sympathetic to her. In fact, when he spots her husband there again, he phones Jill and tips her off.<br /><br />Jill returns to the hotel, sees Sean with another woman. She is upset, leaves without Sean seeing her, and does absolutely nothing. In fact, she doesn't even say anything to Sean when he arrives home. This made no sense to me.<br /><br />Jill has given Richard her business card, and so he calls her and she is apparently in real estate. She shows him a condo. Afterwards they have a drink, and things get cozy between them.<br /><br />Richard and Jill are getting it on, hot and heavy. In fact, he seems a bit more aggressive than necessary, when Jill suddenly decides to cut out.<br /><br />Jill and Sean have a confrontation about his cheating. Sean whines about how Jill has been letting him down since her father died. Apparently his lack of any morals is all her fault. Eventually Jill confesses her own lack of morals and near adultery to Sean--and of course that's all her fault too, as far as Sean is concerned.<br /><br />The little family decides to go on a camping trip--which means more whining and grousing among them, especially from the spoiled daughter.<br /><br />I was so rooting for the stalker to get everybody, but Jill.<br /><br />3 stars",0
45,"This movie sucked. It really was a waste of my life. The acting was atrocious, the plot completely implausible. Long, long story short, these people get ""terrorized"" by this pathetic ""crazed killer"", but completely fail to fight back in any manner. And this is after they take a raft on a camping trip, with no gear, and show up at a campsite that is already assembled and completely stocked with food and clothes and the daughters headphones. Additionally, after their boat goes missing, they panic that they're stuck in the woods, but then the daughters boyfriend just shows up and they apparently never consider that they could just hike out of the woods like he did to get to them. Like I said, this movie sucks. A complete joke. Don't let your girlfriend talk you into watching it.",0
46,"Lifetime did it again. Can we say stupid? I couldn't wait for it to end. The plot was senseless. The acting was terrible! Especially by the teenagers. The story has been played a thousand times! Are we just desperate to give actors a job? The previews were attractive and I was really looking for a good thriller.Once in awhile lifetime comes up with a good movie, this isn't one of them. Unless one has nothing else to do I would avoid this one at all cost. This was a waste of two hours of my life. Can I get them back? I would have rather scraped my face against a brick wall for two hours then soaked it in peroxide. That would have been more entertaining.",0
47,"I have to say I am really surprised at the high ratings for this movie. I found it to be absolutely idiotic. The mother gets ""visions"" when she touches certain things or people? And one thing she touched twice made her vision continue... Just seemed so ridiculous. Deedee Pfieffer's performance was awful I thought. She was very irritating. The girl who played Lori did a good job and so did most of the supporting cast for what they had to work with.<br /><br />I usually love LMN and am very open minded when it comes to movies but this movie seemed to have a ridiculous plot and over the top acting and it just was not for me.",0
48,The original book of this was set in the 1950s but that won't do for the TV series because most people watch for the 1930s style. Ironically the tube train near the end was a 1950s train painted to look like a 1930s train so the Underground can play at that game too. Hanging the storyline on a plot about the Jarrow March was feeble but the 50s version had students who were beginning to think about the world around them so I suppose making them think about the poverty of the marchers is much the same thing. All the stuff about Japp having to cater for himself was weak too but they had to put something in to fill the time. This would have made a decent half hour show or they could have filmed the book and made it a better long show. It is obvious this episode is a victim of style over content.,0
49,"The annoying mouse and lullaby really got to me and really had nothing to do with the story...It's something I would have done my 1st year in film school. Very sad. Additionally, the story just seemed to drag on for no apparent reason...there were too many things just thrown in there that had nothing to do with the story, which makes me feel that the creative team didn't really know what they were doing, or just that it should have been shorter...which would have been a blessing, not a crime. As I have just watched all of the episodes up to this point over the past week...I'd have to say that this was by far the worst, and I just wanted to warn others not to start with this one.",0
50,"I saw this film opening weekend in Australia, anticipating with an excellent cast of Ledger, Edgerton, Bloom, Watts and Rush that the definitive story of Ned Kelly would unfold before me. Unfortunately, despite an outstanding performance by Heath Ledger in the lead role, the plot was paper thin....which doesn't inspire me to read ""Our Sunshine"". There were some other plus points, the support acting from Edgerton in particular, assured direction from Jordan (confirming his talent on show in Buffalo Soldiers as well), and production design that gave a real feel of harshness to the Australian bush, much as the Irish immigrants of the early 19th century must have seen it. But I can't help feeling that another opportunity has been missed to tell the real story of an Australian folk hero (or was he?)....in what I suspect is a concession to Hollywood and selling the picture in the US. Oh well, at least Jordan and the producers didn't agree to lose the beards just to please Universal...<br /><br />Guess I will just have to content myself with Peter Carey's excellent ""Secret History of the Kelly Gang"". 4/10",0
51,"I saw this at the premiere in Melbourne<br /><br />It is shallow, two-dimensional, unaffecting and, hard to believe given the subject matter, boring. The actors are passable, but they didn't have much to work with given the very plodding and unimpressive script. For those who might have worried that Ned Kelly would be over-intellectualised, you can take comfort in the fact that this telling of the story is utterly without any literary depth at all, told entirely on the surface and full of central casting standards. However, it doesn't work as a popcorn film either. Its pacing is too off-kilter and its craft is too lacking to satisfy even on the level of a mundane actioner.<br /><br />I very much doubt Gregor Jordan could sit back and say to himself ""this is the best I could have done with the material"".<br /><br />Ned Kelly is a fascinating figure, and equally so is the national response to him. Possibly folk genius, possibly class warrior, possibly psychopath and probably all these things, he has dominated Australian true mythology for over 120 years. Once again, his story has failed miserably on the big screen.<br /><br />Such is life.",0
52,"Ned Kelly (Ledger), the infamous Australian outlaw and legend. Sort of like Robin Hood, with a mix of Billy the Kid, Australians love the legend of how he stood up against the English aristocratic oppression, and united the lower classes to change Australia forever. The fact that the lower classes of the time were around 70% immigrant criminals seems to be casually skimmed around by this film. Indeed, quite a few so called `facts' in this film are, on reflection, a tad dubious.<br /><br />I suppose the suspicions should have been aroused when, in the opening credits, it was claimed that this film is based upon the book, `Our Sunshine'. If ever a romanticized version of truth could be seen in a name for a book, there it was. This wasn't going to be a historical epic, but just an adaptation of one of many dubious legends of Ned Kelly, albeit a harsh and sporadically brutal version.<br /><br />Unfortunately, Ned Kelly is nothing more than an overblown Hallmark channel `real life historical drama' wannabe! The story plods along at an alarming rate (alarming because never has a film plodded so slowly!) The feeling of numbness after the two hours of pure drivel brought back memories of Costner's awful Wyatt Earp all those years ago. Simply put, nothing happens in the film, but it takes a long time getting to that nothing. This would possibly have been a tad more bearable if the performances were good (because the direction sure as heck wasn't). However, unless you are looking to play a game of spot the worst Oirish accent, then you're gonna be disappointed. Between that, the game of `Who has the stupidest beard?', `Spot the obvious backstabber!' (clue, they are all ginger for some reason), and `Nature in Australia.including lions', it is an experience similar to flicking through Hallmark, The History Channel, Discovery Channel, and Neighbours whilst suffering a huge hangover. Yup, nature pops up a lot, as to fill even more time (possibly an attempt to look arty), the film keeps showing pointless wildlife shots, and once all the native species are shown, here's a circus to allow for a camel and a lion (which is used during one fight to try to make us actually feel more sorry for the lion than the massacred people).<br /><br />This is a turgid, emotionless piece of historical fluff which should have gone straight to TV. There isn't even one good word I can say about this film. Even the usually fantastic Rush seems embarrassed to be here. When one of the characters comments that there is only 2 bullets left for him and his pal, I myself was wishing I had a gun to blow any memory of this film out of my head!",0
53,"They constructed this one as a kind of fantasy Man From Snowy River meets Butch Cassidy and the Sundance kid, and just for a romantic touch Ned and Joe get to play away with high class talent, the bored young wives of wealthy older men. OK, there are lots of myths about Ned Kelly, but there are also a lot of well documented facts, still leaving space for artistic creativity in producing a good historical dramaticisation. I mean, this is not the Robin Hood story, not the Arthurian legends, not Beowulf, not someone whose life is so shrouded in the mists of many many centuries past that any recreation of their life and times is 99% guesswork. It's only a couple of lifetimes ago. My own grandparents were already of school age when Ned was hanged. <br /><br />So it's silly me for fancifully imagining this movie was a serious attempt to tell the Kelly story. Having recently read Peter Carey's excellent novel ""The True History of the Kelly Gang"" I had eagerly anticipated that this would be in similar vein. But no, the fact is that Mick Jagger's much derided 1970 Kelly was probably far closer to reality, and a better movie overall, which isn't saying a whole lot for it.<br /><br />Glad it only cost me two bucks to hire the DVD! I'll give it 3/10, and that's only because some of the nice shots of the Australian bush make me feel generous.",0
54,"This has to be the worst piece of garbage I've seen in a while.<br /><br />Heath Ledger is a heartthrob? He looked deformed. I wish I'd known that he and Naomi Watts are an item in real life because I spent 2 of the longest hours of my life wondering what she saw in him. <br /><br />Orlando Bloom is a heartthrob? With the scraggly beard and deer-in-the-headlights look about him, I can't say I agree.<br /><br />Rachel Griffiths was her usual fabulous self, but Geoffrey Rush looked as if he couldn't wait to get off the set. <br /><br />I'm supposed to feel sorry for bankrobbers and murderers? This is a far cry from Butch Cassidy, which actually WAS an entertaining film. This was trite, cliche-ridden and boring. We only stayed because we were convinced it would get better. It didn't.<br /><br />The last 10-15 minutes or so were unintentionally hilarious. Heath and his gang are holed up in a frontier hotel, and women and children are dying because of their presence. That's not funny. But it was funny when they walked out of the hotel with the armor on, because all we could think of was the Black Knight from Monty Python and the Holy Grail. I kept waiting for them to say ""I'll bite yer leg off!"" We were howling with laughter, as were several other warped members of the audience. When we left, pretty much everyone was talking about what a waste of time this film was.<br /><br />I may not have paid cash to see this disaster (sneak preview), but it certainly wasn't free. It cost me 2 hours of my life that I will never get back.",0
55,"If the term itself were not geographically and semantically meaningless, one might well refer to ""Ned Kelly"" as an ""Australian Western."" For the people Down Under, Ned Kelly was, apparently, a folk hero bandit akin to Robin Hood, Jesse James, Bonnie and Clyde, and Butch Cassidy and the Sundance Kid. The descendant of Irish immigrants, Kelly became a fugitive and an outlaw after he was falsely accused of shooting an Australian law officer, a crime for which his equally innocent mother was put into prison. To get back at the government for this mistreatment, Kelly, his brother Dan, and two other companions, became notorious bank robbers, winning over the hearts of many people in the countryside while striking a blow for justice in a land where Irish immigrants were often treated with disrespect and disdain by those who ran the country.<br /><br />Perhaps because we've encountered this ""gentleman bandit"" scenario so many times in the past, ""Ned Kelly"" feels awfully familiar and unoriginal as it pays homage to any number of the genre's stereotypes and clichés on its way to the inevitable showdown. Ned is the typical heart-of-gold lawbreaker who kills only when he is forced to and, even then, only with the deepest regret. He also has the pulse of the common folk, as when, in the middle of a bank robbery, he returns a valuable watch to one of the customers, after one of his gang has so inconsiderately pilfered it. What movie on this particular subject hasn't featured a scene like that? It's acts of selective generosity like this, of course, that earn him the love and respect of all the little people who come to secretly admire anyone who can get away with sticking it to the powers-that-be and the status quo. Geoffrey Rush plays the typical bedeviled law enforcer who feels a personal stake in bringing down this upstart troublemaker who keeps getting away with tweaking the establishment. There's even the inevitable episode in which one of the ladies being held up goes into the next room and has sex with one of the robbers, so turned on is she by the romantic derring-do of the criminal lifestyle. And the film is riddled with one hackneyed scene like this after another.<br /><br />Heath Ledger fails to distinguish himself in the title role, providing little in the way of substance to make his character either interesting or engaging. It doesn't help that he has been forced to provide a droning voice-over narration that underlines the sanctimoniousness and pretentiousness of both the character and the film.<br /><br />""Ned Kelly"" might serve a function of sorts as a lesson in Australian history, but as an entertainment, it's just the same old story told with different accents.",0
56,"This movie was so unrelentingly bad, I could hardly believe I was watching it. The directing, editing, production, and script all seemed as though they had been done by junior high school students who don't know all that much about movies. There was no narrative flow that made any sort of sense. Big emotional moments and climaxes (like one early on between Heath Ledger and Naomi Watts) and character relationships (like one hinted at at the very beginning) come completely out of no where and are not set up like they would have been in a more elegantly and effectively made film. The characters are sadly underdeveloped, making it difficult for us to have any sort of connection with them. The acting, surprisingly, is not entirely bad, but the terrible writing cancels out the relatively convincing performances. The film plays like a particularly bad T.V. western/epic, and sadly diminishes the fascinating (true) story that it attempts to tell. I have read a lot of reviews that defend the film as being important to Australians because of the subject matter. That's all very well, but just because Ned Kelly is an important Australian historical icon DOESN'T MAKE THE MOVIE GOOD. No one is saying that the subject matter isn't good, just the quality of the movie itself. Pearl Harbor was about a very important historical event to Americans, but that doesn't mean I'm going to defend the movie and say it was good, because it was still bad. A failure all around, though Heath and Orlando are lovely to look at.",0
57,"This movie never made it to theaters in our area, so when it became available on DVD I was one of the first to rent it. For once, I should listened to the critics and passed on this one.<br /><br />Despite the excellent line up of actors the movie was very disappointing. I can see now why it went straight to video. <br /><br />I had thought that with Bloom, Ledger, and Rush it could have some value. All have done wonderful work in the past. <br /><br />The movie was slow moving and never pulled me in. I failed to develop much empathy for the characters and had to fight the urge to fast-forward just to get to the end. <br /><br />I do not recommend this film even if you are thinking of renting it for only for 'eye candy' purposes. It won't satisfy even that.",0
58,"I thought this was a very clunky, uninvolving version of a famous Australian story. Heath Ledger and Orlando Bloom were very good in their roles, and gave their characters some personality; but the whole thing felt forced and mechanical.<br /><br />The beginning could have been a lot more involving; perhaps starting with a shootout, and then flashing back for a recap of how they got there or that sort of thing. And I felt like every scene was routinely predictable and signposted, like a very bad tv soap.<br /><br />I was really looking forward to this movie, and hoping for something a lot better. The only thing I can say in its favour is that it beats the Mick Jagger version, but not by much.",0
